{"backups":{"enabled":false},"change_notice":{"archive_url":"https://github.com/yunfie-twitter/PallaSync/pulls?q=is%3Apr","minimum_notice_ms":0,"notice_url":"https://github.com/yunfie-twitter/PallaSync/pulls?q=is%3Apr"},"copies":{"active_store":{"after_delete":{"max_ms":60000,"mode":"erase"},"content":"ciphertext","locations":["日本。運用者ゆんふぃが管理するUbuntu Linuxサーバーの永続Docker volume"],"present":true,"purpose":"Accepted encrypted objects and signed protocol state","recipients":["運用者ゆんふぃ、許可されたOS管理者・Docker管理者"],"retention":{"mode":"until_chain_deletion"}},"attestations":{"after_delete":{"max_ms":null,"mode":"retain_authority_evidence"},"content":"authority_evidence","locations":["日本。運用者ゆんふぃが管理するUbuntu Linuxサーバーの永続Docker volume"],"present":true,"purpose":"Signed receipts, object hashes, public transparency links and heads","recipients":["運用者ゆんふぃ、許可されたOS管理者・Docker管理者"],"retention":{"mode":"indefinite"}},"backup":{"present":false},"cache":{"after_delete":{"max_ms":null,"mode":"retain_metadata"},"content":"metadata","locations":["日本。運用者ゆんふぃが管理するUbuntu Linuxサーバーの永続Docker volume"],"present":true,"purpose":"Persistent rate buckets using immediate upstream IP hashes and update timestamps","recipients":["運用者ゆんふぃ、許可されたOS管理者・Docker管理者"],"retention":{"mode":"indefinite"}},"deletion_ledger":{"after_delete":{"max_ms":null,"mode":"retain_authority_evidence"},"content":"authority_evidence","locations":["日本。運用者ゆんふぃが管理するUbuntu Linuxサーバーの永続Docker volume"],"present":true,"purpose":"Minimal signed deletion authorization and anti-resurrection proof","recipients":["運用者ゆんふぃ、許可されたOS管理者・Docker管理者"],"retention":{"mode":"indefinite"}},"operational_log":{"after_delete":{"max_ms":null,"mode":"retain_metadata"},"content":"metadata","locations":["Cloudflare global network; processing may occur outside Japan"],"present":true,"purpose":"Network security, service availability and traffic analysis; no finite metadata retention maximum promised","recipients":["Cloudflare, Inc. and its service providers"],"retention":{"mode":"indefinite"}},"replica":{"present":false},"snapshot_store":{"after_delete":{"max_ms":60000,"mode":"erase"},"content":"ciphertext","locations":["日本。運用者ゆんふぃが管理するUbuntu Linuxサーバーの永続Docker volume"],"present":true,"purpose":"Encrypted snapshots subject to authenticated compaction and retention rules","recipients":["運用者ゆんふぃ、許可されたOS管理者・Docker管理者"],"retention":{"mode":"until_chain_deletion"}},"staging":{"after_delete":{"max_ms":60000,"mode":"erase"},"content":"ciphertext","locations":["日本。運用者ゆんふぃが管理するUbuntu Linuxサーバーの永続Docker volume"],"present":true,"purpose":"Import and snapshot staging until publication, protocol cleanup, or chain deletion","recipients":["運用者ゆんふぃ、許可されたOS管理者・Docker管理者"],"retention":{"mode":"until_chain_deletion"}},"support":{"present":false},"temporary_export":{"present":false},"wal":{"after_delete":{"max_ms":60000,"mode":"erase"},"content":"ciphertext","locations":["日本。運用者ゆんふぃが管理するUbuntu Linuxサーバーの永続Docker volume"],"present":true,"purpose":"SQLite transaction durability; WAL is checkpointed during operation","recipients":["運用者ゆんふぃ、許可されたOS管理者・Docker管理者"],"retention":{"mode":"until_chain_deletion"}}},"deletion":{"active_delete_max_ms":60000,"assurance":"backup-expiry","backup_delete_max_ms":null,"key_destroy_max_ms":null},"disclosure_id":"fbbc7392-f700-420c-b8a3-3f935c754bdb","durability_tier":"single-durable","effective_at_ms":1791731093217,"limits":{"max_devices":128,"max_records_per_upload":64,"max_request_bytes":8388608,"page_limit":1000},"markdown_sha256":"aWr29hCTlRP8IOA5CXzBS5fyGw6-eRas2NJg2qnsXo4","metadata":{"purposes":["Persistent rate limiting with source IP digests and last update times","Network security, service availability and traffic analysis; no finite metadata retention maximum promised"],"recipients":["運用者ゆんふぃ、許可されたOS管理者・Docker管理者","Cloudflare, Inc. and its service providers"],"retained_fields":["ip","user_agent","connection_time","request_path_class","response_status","timing","byte_count"],"retention":{"mode":"indefinite"}},"operator":{"contact_url":"https://api.yunfi.f5.si/privacy.md","name":"ゆんふぃ"},"published_at_ms":1791731093217,"quota":{"allocation_rule":"All chains have no configured quota. Count stored signed objects, IDs/hashes, log wrappers, receipts, transparency/head evidence, outcomes, cursors and offers; exclude SQLite/WAL physical overhead.","allow_unconfigured":true,"counted_components":["record","snapshot","envelope","device_meta","receipt","transparency","control"],"maximum_bytes":null,"minimum_bytes":0},"rate_limits":{"authorized_signer":{"burst":30,"requests_per_minute":120},"enrollment_offer":{"burst":1,"requests_per_minute":3},"enrollment_source_ip":{"burst":3,"requests_per_minute":6},"public_document_ip":{"burst":60,"requests_per_minute":240},"record_upload_device":{"burst":10,"requests_per_minute":30}},"relay_key":{"automatic_rotation":false,"new_transparency_id_required":true,"old_verification_keys_retained":true,"protection":"passphrase_wrapped","replacement_mode":"explicit_trust_reestablishment"},"relay_key_id":"kaIMLJ9IFYPfw8DsH-79tONuUTPOs4ruaZoK1Wtnlzc","relay_origin":"https://api.yunfi.f5.si","relay_signature":"lcg9-PwYbaZxNWqHqw4fxtNW40-xXIOfne5oDKTX_HlzIhFddDlru7KsSXpDi8SB5VJ8qvOawcOFYOW5HDZeAQ","replay_protection":{"mode":"durable"},"revision":1,"type":"PALLASYNC-RELAY-PRIVACY-v3","version":"3.0"}